{
  "schemaVersion": "1.0.0",
  "authorizationId": "71717171-7171-4171-8171-717171717171",
  "authorityId": "76767676-7676-4676-8676-767676767676",
  "sessionId": "70707070-7070-4070-8070-707070707070",
  "requestNonce": "72727272-7272-4272-8272-727272727272",
  "viewerGithubNodeId": "U_maintainer_admin",
  "installationId": 9001,
  "repositoryNodeId": "R_fixture_target",
  "repositoryPermission": "admin",
  "assessmentId": "11111111-1111-4111-8111-111111111111",
  "assessmentDigest": "3f4384158b9044f81070c120ec4fa9a3fc37e1f4543b8fe6293e1ce742878418",
  "permissionObservationId": "74747474-7474-4474-8474-747474747474",
  "permissionObservationDigest": "98c33e952a25850a4f6728aa506c1a15cd420ae193274c54a0cdbac0daf3be83",
  "policyStreamId": "15151515-1515-4151-8151-151515151515",
  "policyHeadRevision": 1,
  "policyHeadRevisionId": "13131313-1313-4131-8131-131313131313",
  "policyHeadDigest": "0a1b26d5ca9f6cdb4301aa220c49a12eb8bd2100080fc49b8e9297fc1e88bae6",
  "databaseSnapshotToken": "760282ef04ec91407d2d9fcb88963c9f6d64fd49375844a305d015e8d368a48f",
  "policyHeadReadAt": "2026-07-21T00:00:01.050Z",
  "authorizedAt": "2026-07-21T00:00:01.100Z",
  "expiresAt": "2026-07-21T00:05:01.100Z",
  "nonceConsumptionId": "71717171-4444-4444-8444-444444444444",
  "nonceConsumptionDigest": "99d47d94b859ceefbd62badd985f386ed54bd3163db044d50d0209e9511163be",
  "nonceConsumptionCommitToken": "d1d9a7dc6f3ceb46fe7ae6e0630cc06f238a6a1c537ece77233575b9869633df",
  "authorizationDigest": "77146865c8ab81d423c930ec392bf8b6ed944acfefc8f962b192088287f8fc84"
}
